=== Clear ALL Entities & Relations From DAO Space ===
Mode: LIVE
DAO space: 0x6b05a4fc85e69e56c15e2c6891e1df32 @ 0xd3a0cce0d01214a1fc5cdedf8ca78bc1618f7c2f
Mode: --all (loop until empty, 50K chunks)
Confirmation: skipped (--yes)

   Smart account: 0x8218f02D37bEC2bf4aa982a60A61B31353d972c7
   Personal space ID: 0xbaddbe29ee5c1764925996eafba6d00f

============================================================
=== Pass 1 ===
============================================================

0) Querying before-counts...
   Entities before:  142110
   Relations before: 252945

1) Querying entities in DAO space...
     fetching page 1 (0 so far)...     fetching page 2 (200 so far)...     fetching page 3 (400 so far)...     fetching page 4 (600 so far)...     fetching page 5 (800 so far)...     fetching page 6 (1000 so far)...     fetching page 7 (1200 so far)...     fetching page 8 (1400 so far)...     fetching page 9 (1600 so far)...     fetching page 10 (1800 so far)...     fetching page 11 (2000 so far)...     fetching page 12 (2200 so far)...     fetching page 13 (2400 so far)...     fetching page 14 (2600 so far)...     fetching page 15 (2800 so far)...     fetching page 16 (3000 so far)...     fetching page 17 (3200 so far)...     fetching page 18 (3400 so far)...     fetching page 19 (3600 so far)...     fetching page 20 (3800 so far)...     fetching page 21 (4000 so far)...     fetching page 22 (4200 so far)...     fetching page 23 (4400 so far)...     fetching page 24 (4600 so far)...     fetching page 25 (4800 so far)...     fetching page 26 (5000 so far)...     fetching page 27 (5200 so far)...     fetching page 28 (5400 so far)...     fetching page 29 (5600 so far)...     fetching page 30 (5800 so far)...     fetching page 31 (6000 so far)...     fetching page 32 (6200 so far)...     fetching page 33 (6400 so far)...     fetching page 34 (6600 so far)...     fetching page 35 (6800 so far)...     fetching page 36 (7000 so far)...     fetching page 37 (7200 so far)...     fetching page 38 (7400 so far)...     fetching page 39 (7600 so far)...     fetching page 40 (7800 so far)...     fetching page 41 (8000 so far)...     fetching page 42 (8200 so far)...     fetching page 43 (8400 so far)...     fetching page 44 (8600 so far)...     fetching page 45 (8800 so far)...     fetching page 46 (9000 so far)...     fetching page 47 (9200 so far)...     fetching page 48 (9400 so far)...     fetching page 49 (9600 so far)...     fetching page 50 (9800 so far)...     fetching page 51 (10000 so far)...     fetching page 52 (10200 so far)...     fetching page 53 (10400 so far)...     fetching page 54 (10600 so far)...     fetching page 55 (10800 so far)...     fetching page 56 (11000 so far)...     fetching page 57 (11200 so far)...     fetching page 58 (11400 so far)...     fetching page 59 (11600 so far)...     fetching page 60 (11800 so far)...     fetching page 61 (12000 so far)...     fetching page 62 (12200 so far)...     fetching page 63 (12400 so far)...     fetching page 64 (12600 so far)...     fetching page 65 (12800 so far)...     fetching page 66 (13000 so far)...     fetching page 67 (13200 so far)...     fetching page 68 (13400 so far)...     fetching page 69 (13600 so far)...     fetching page 70 (13800 so far)...     fetching page 71 (14000 so far)...     fetching page 72 (14200 so far)...     fetching page 73 (14400 so far)...     fetching page 74 (14600 so far)...     fetching page 75 (14800 so far)...     fetching page 76 (15000 so far)...     fetching page 77 (15200 so far)...     fetching page 78 (15400 so far)...     fetching page 79 (15600 so far)...     fetching page 80 (15800 so far)...     fetching page 81 (16000 so far)...     fetching page 82 (16200 so far)...     fetching page 83 (16400 so far)...     fetching page 84 (16600 so far)...     fetching page 85 (16800 so far)...     fetching page 86 (17000 so far)...     fetching page 87 (17200 so far)...     fetching page 88 (17400 so far)...     fetching page 89 (17600 so far)...     fetching page 90 (17800 so far)...     fetching page 91 (18000 so far)...     fetching page 92 (18200 so far)...     fetching page 93 (18400 so far)...     fetching page 94 (18600 so far)...     fetching page 95 (18800 so far)...     fetching page 96 (19000 so far)...     fetching page 97 (19200 so far)...     fetching page 98 (19400 so far)...     fetching page 99 (19600 so far)...     fetching page 100 (19800 so far)...     fetching page 101 (20000 so far)...     fetching page 102 (20200 so far)...     fetching page 103 (20400 so far)...     fetching page 104 (20600 so far)...     fetching page 105 (20800 so far)...     fetching page 106 (21000 so far)...     fetching page 107 (21200 so far)...     fetching page 108 (21400 so far)...     fetching page 109 (21600 so far)...     fetching page 110 (21800 so far)...     fetching page 111 (22000 so far)...     fetching page 112 (22200 so far)...     fetching page 113 (22400 so far)...     fetching page 114 (22600 so far)...     fetching page 115 (22800 so far)...     fetching page 116 (23000 so far)...     fetching page 117 (23200 so far)...     fetching page 118 (23400 so far)...     fetching page 119 (23600 so far)...     fetching page 120 (23800 so far)...     fetching page 121 (24000 so far)...     fetching page 122 (24200 so far)...     fetching page 123 (24400 so far)...     fetching page 124 (24600 so far)...     fetching page 125 (24800 so far)...     fetching page 126 (25000 so far)...     fetching page 127 (25200 so far)...     fetching page 128 (25400 so far)...     fetching page 129 (25600 so far)...     fetching page 130 (25800 so far)...     fetching page 131 (26000 so far)...     fetching page 132 (26200 so far)...     fetching page 133 (26400 so far)...     fetching page 134 (26600 so far)...     fetching page 135 (26800 so far)...     fetching page 136 (27000 so far)...     fetching page 137 (27200 so far)...     fetching page 138 (27400 so far)...     fetching page 139 (27600 so far)...     fetching page 140 (27800 so far)...     fetching page 141 (28000 so far)...     fetching page 142 (28200 so far)...     fetching page 143 (28400 so far)...     fetching page 144 (28600 so far)...     fetching page 145 (28800 so far)...     fetching page 146 (29000 so far)...     fetching page 147 (29200 so far)...     fetching page 148 (29400 so far)...     fetching page 149 (29600 so far)...     fetching page 150 (29800 so far)...     fetching page 151 (30000 so far)...     fetching page 152 (30200 so far)...     fetching page 153 (30400 so far)...     fetching page 154 (30600 so far)...     fetching page 155 (30800 so far)...     fetching page 156 (31000 so far)...     fetching page 157 (31200 so far)...     fetching page 158 (31400 so far)...     fetching page 159 (31600 so far)...     fetching page 160 (31800 so far)...     fetching page 161 (32000 so far)...     fetching page 162 (32200 so far)...     fetching page 163 (32400 so far)...     fetching page 164 (32600 so far)...     fetching page 165 (32800 so far)...     fetching page 166 (33000 so far)...     fetching page 167 (33200 so far)...     fetching page 168 (33400 so far)...     fetching page 169 (33600 so far)...     fetching page 170 (33800 so far)...     fetching page 171 (34000 so far)...     fetching page 172 (34200 so far)...     fetching page 173 (34400 so far)...     fetching page 174 (34600 so far)...     fetching page 175 (34800 so far)...     fetching page 176 (35000 so far)...     fetching page 177 (35200 so far)...     fetching page 178 (35400 so far)...     fetching page 179 (35600 so far)...     fetching page 180 (35800 so far)...     fetching page 181 (36000 so far)...     fetching page 182 (36200 so far)...     fetching page 183 (36400 so far)...     fetching page 184 (36600 so far)...     fetching page 185 (36800 so far)...     fetching page 186 (37000 so far)...     fetching page 187 (37200 so far)...     fetching page 188 (37400 so far)...     fetching page 189 (37600 so far)...     fetching page 190 (37800 so far)...     fetching page 191 (38000 so far)...     fetching page 192 (38200 so far)...     fetching page 193 (38400 so far)...     fetching page 194 (38600 so far)...     fetching page 195 (38800 so far)...     fetching page 196 (39000 so far)...     fetching page 197 (39200 so far)...     fetching page 198 (39400 so far)...     fetching page 199 (39600 so far)...     fetching page 200 (39800 so far)...     fetching page 201 (40000 so far)...     fetching page 202 (40200 so far)...     fetching page 203 (40400 so far)...     fetching page 204 (40600 so far)...     fetching page 205 (40800 so far)...     fetching page 206 (41000 so far)...     fetching page 207 (41200 so far)...     fetching page 208 (41400 so far)...     fetching page 209 (41600 so far)...     fetching page 210 (41800 so far)...     fetching page 211 (42000 so far)...     fetching page 212 (42200 so far)...     fetching page 213 (42400 so far)...     fetching page 214 (42600 so far)...     fetching page 215 (42800 so far)...     fetching page 216 (43000 so far)...     fetching page 217 (43200 so far)...     fetching page 218 (43400 so far)...     fetching page 219 (43600 so far)...     fetching page 220 (43800 so far)...     fetching page 221 (44000 so far)...     fetching page 222 (44200 so far)...     fetching page 223 (44400 so far)...     fetching page 224 (44600 so far)...     fetching page 225 (44800 so far)...     fetching page 226 (45000 so far)...     fetching page 227 (45200 so far)...     fetching page 228 (45400 so far)...     fetching page 229 (45600 so far)...     fetching page 230 (45800 so far)...     fetching page 231 (46000 so far)...     fetching page 232 (46200 so far)...     fetching page 233 (46400 so far)...     fetching page 234 (46600 so far)...     fetching page 235 (46800 so far)...     fetching page 236 (47000 so far)...     fetching page 237 (47200 so far)...     fetching page 238 (47400 so far)...     fetching page 239 (47600 so far)...     fetching page 240 (47800 so far)...     fetching page 241 (48000 so far)...     fetching page 242 (48200 so far)...     fetching page 243 (48400 so far)...     fetching page 244 (48600 so far)...     fetching page 245 (48800 so far)...     fetching page 246 (49000 so far)...     fetching page 247 (49200 so far)...     fetching page 248 (49400 so far)...     fetching page 249 (49600 so far)...     fetching page 250 (49800 so far)...                                                               Found 50000 entities
   Sample:
     - 5650be6c8e9946698eb43d7bff95019a :: 0x8218f02D37bEC2bf4aa982a60A61B31353d972c7
     - 1c44c862740b439e94cbd9e66d644e36 :: 0x8218f02D37bEC2bf4aa982a60A61B31353d972c7
     - e291409ac8bc44809aa107e510f76b76 :: 0x8218f02D37bEC2bf4aa982a60A61B31353d972c7
     - 470cd4231c264ad886423ce56f61ecc8 :: 0x8218f02D37bEC2bf4aa982a60A61B31353d972c7
     - 4a0493fd9a644b2e87a64829a19c781e :: 0x8218f02D37bEC2bf4aa982a60A61B31353d972c7
   ... and 49995 more

2) Querying relations in DAO space...
     fetching page 1 (0 so far)...     fetching page 2 (200 so far)...     fetching page 3 (400 so far)...     fetching page 4 (600 so far)...     fetching page 5 (800 so far)...     fetching page 6 (1000 so far)...     fetching page 7 (1200 so far)...     fetching page 8 (1400 so far)...     fetching page 9 (1600 so far)...     fetching page 10 (1800 so far)...     fetching page 11 (2000 so far)...     fetching page 12 (2200 so far)...     fetching page 13 (2400 so far)...     fetching page 14 (2600 so far)...     fetching page 15 (2800 so far)...     fetching page 16 (3000 so far)...     fetching page 17 (3200 so far)...     fetching page 18 (3400 so far)...     fetching page 19 (3600 so far)...     fetching page 20 (3800 so far)...     fetching page 21 (4000 so far)...     fetching page 22 (4200 so far)...     fetching page 23 (4400 so far)...     fetching page 24 (4600 so far)...     fetching page 25 (4800 so far)...     fetching page 26 (5000 so far)...     fetching page 27 (5200 so far)...     fetching page 28 (5400 so far)...     fetching page 29 (5600 so far)...     fetching page 30 (5800 so far)...     fetching page 31 (6000 so far)...     fetching page 32 (6200 so far)...     fetching page 33 (6400 so far)...     fetching page 34 (6600 so far)...     fetching page 35 (6800 so far)...     fetching page 36 (7000 so far)...     fetching page 37 (7200 so far)...     fetching page 38 (7400 so far)...     fetching page 39 (7600 so far)...     fetching page 40 (7800 so far)...     fetching page 41 (8000 so far)...     fetching page 42 (8200 so far)...     fetching page 43 (8400 so far)...     fetching page 44 (8600 so far)...     fetching page 45 (8800 so far)...     fetching page 46 (9000 so far)...     fetching page 47 (9200 so far)...     fetching page 48 (9400 so far)...     fetching page 49 (9600 so far)...     fetching page 50 (9800 so far)...     fetching page 51 (10000 so far)...     fetching page 52 (10200 so far)...     fetching page 53 (10400 so far)...     fetching page 54 (10600 so far)...     fetching page 55 (10800 so far)...     fetching page 56 (11000 so far)...     fetching page 57 (11200 so far)...     fetching page 58 (11400 so far)...     fetching page 59 (11600 so far)...     fetching page 60 (11800 so far)...     fetching page 61 (12000 so far)...     fetching page 62 (12200 so far)...     fetching page 63 (12400 so far)...     fetching page 64 (12600 so far)...     fetching page 65 (12800 so far)...     fetching page 66 (13000 so far)...     fetching page 67 (13200 so far)...     fetching page 68 (13400 so far)...     fetching page 69 (13600 so far)...     fetching page 70 (13800 so far)...     fetching page 71 (14000 so far)...     fetching page 72 (14200 so far)...     fetching page 73 (14400 so far)...     fetching page 74 (14600 so far)...     fetching page 75 (14800 so far)...     fetching page 76 (15000 so far)...     fetching page 77 (15200 so far)...     fetching page 78 (15400 so far)...     fetching page 79 (15600 so far)...     fetching page 80 (15800 so far)...     fetching page 81 (16000 so far)...     fetching page 82 (16200 so far)...     fetching page 83 (16400 so far)...     fetching page 84 (16600 so far)...     fetching page 85 (16800 so far)...     fetching page 86 (17000 so far)...     fetching page 87 (17200 so far)...     fetching page 88 (17400 so far)...     fetching page 89 (17600 so far)...     fetching page 90 (17800 so far)...     fetching page 91 (18000 so far)...     fetching page 92 (18200 so far)...     fetching page 93 (18400 so far)...     fetching page 94 (18600 so far)...     fetching page 95 (18800 so far)...     fetching page 96 (19000 so far)...     fetching page 97 (19200 so far)...     fetching page 98 (19400 so far)...     fetching page 99 (19600 so far)...     fetching page 100 (19800 so far)...     fetching page 101 (20000 so far)...     fetching page 102 (20200 so far)...     fetching page 103 (20400 so far)...     fetching page 104 (20600 so far)...     fetching page 105 (20800 so far)...     fetching page 106 (21000 so far)...     fetching page 107 (21200 so far)...     fetching page 108 (21400 so far)...     fetching page 109 (21600 so far)...     fetching page 110 (21800 so far)...     fetching page 111 (22000 so far)...     fetching page 112 (22200 so far)...     fetching page 113 (22400 so far)...     fetching page 114 (22600 so far)...     fetching page 115 (22800 so far)...     fetching page 116 (23000 so far)...     fetching page 117 (23200 so far)...     fetching page 118 (23400 so far)...     fetching page 119 (23600 so far)...     fetching page 120 (23800 so far)...     fetching page 121 (24000 so far)...     fetching page 122 (24200 so far)...     fetching page 123 (24400 so far)...     fetching page 124 (24600 so far)...     fetching page 125 (24800 so far)...     fetching page 126 (25000 so far)...     fetching page 127 (25200 so far)...     fetching page 128 (25400 so far)...     fetching page 129 (25600 so far)...     fetching page 130 (25800 so far)...     fetching page 131 (26000 so far)...     fetching page 132 (26200 so far)...     fetching page 133 (26400 so far)...     fetching page 134 (26600 so far)...     fetching page 135 (26800 so far)...     fetching page 136 (27000 so far)...     fetching page 137 (27200 so far)...     fetching page 138 (27400 so far)...     fetching page 139 (27600 so far)...     fetching page 140 (27800 so far)...     fetching page 141 (28000 so far)...     fetching page 142 (28200 so far)...     fetching page 143 (28400 so far)...     fetching page 144 (28600 so far)...     fetching page 145 (28800 so far)...     fetching page 146 (29000 so far)...     fetching page 147 (29200 so far)...     fetching page 148 (29400 so far)...     fetching page 149 (29600 so far)...     fetching page 150 (29800 so far)...     fetching page 151 (30000 so far)...     fetching page 152 (30200 so far)...     fetching page 153 (30400 so far)...     fetching page 154 (30600 so far)...     fetching page 155 (30800 so far)...     fetching page 156 (31000 so far)...     fetching page 157 (31200 so far)...     fetching page 158 (31400 so far)...     fetching page 159 (31600 so far)...     fetching page 160 (31800 so far)...     fetching page 161 (32000 so far)...     fetching page 162 (32200 so far)...     fetching page 163 (32400 so far)...     fetching page 164 (32600 so far)...     fetching page 165 (32800 so far)...     fetching page 166 (33000 so far)...     fetching page 167 (33200 so far)...     fetching page 168 (33400 so far)...     fetching page 169 (33600 so far)...     fetching page 170 (33800 so far)...     fetching page 171 (34000 so far)...     fetching page 172 (34200 so far)...     fetching page 173 (34400 so far)...     fetching page 174 (34600 so far)...     fetching page 175 (34800 so far)...     fetching page 176 (35000 so far)...     fetching page 177 (35200 so far)...     fetching page 178 (35400 so far)...     fetching page 179 (35600 so far)...     fetching page 180 (35800 so far)...     fetching page 181 (36000 so far)...     fetching page 182 (36200 so far)...     fetching page 183 (36400 so far)...     fetching page 184 (36600 so far)...     fetching page 185 (36800 so far)...     fetching page 186 (37000 so far)...     fetching page 187 (37200 so far)...     fetching page 188 (37400 so far)...     fetching page 189 (37600 so far)...     fetching page 190 (37800 so far)...     fetching page 191 (38000 so far)...     fetching page 192 (38200 so far)...     fetching page 193 (38400 so far)...     fetching page 194 (38600 so far)...     fetching page 195 (38800 so far)...     fetching page 196 (39000 so far)...     fetching page 197 (39200 so far)...     fetching page 198 (39400 so far)...     fetching page 199 (39600 so far)...     fetching page 200 (39800 so far)...     fetching page 201 (40000 so far)...     fetching page 202 (40200 so far)...     fetching page 203 (40400 so far)...     fetching page 204 (40600 so far)...     fetching page 205 (40800 so far)...     fetching page 206 (41000 so far)...     fetching page 207 (41200 so far)...     fetching page 208 (41400 so far)...     fetching page 209 (41600 so far)...     fetching page 210 (41800 so far)...     fetching page 211 (42000 so far)...     fetching page 212 (42200 so far)...     fetching page 213 (42400 so far)...     fetching page 214 (42600 so far)...     fetching page 215 (42800 so far)...     fetching page 216 (43000 so far)...     fetching page 217 (43200 so far)...     fetching page 218 (43400 so far)...     fetching page 219 (43600 so far)...     fetching page 220 (43800 so far)...     fetching page 221 (44000 so far)...     fetching page 222 (44200 so far)...     fetching page 223 (44400 so far)...     fetching page 224 (44600 so far)...     fetching page 225 (44800 so far)...     fetching page 226 (45000 so far)...     fetching page 227 (45200 so far)...     fetching page 228 (45400 so far)...     fetching page 229 (45600 so far)...     fetching page 230 (45800 so far)...     fetching page 231 (46000 so far)...     fetching page 232 (46200 so far)...     fetching page 233 (46400 so far)...     fetching page 234 (46600 so far)...     fetching page 235 (46800 so far)...     fetching page 236 (47000 so far)...     fetching page 237 (47200 so far)...     fetching page 238 (47400 so far)...     fetching page 239 (47600 so far)...     fetching page 240 (47800 so far)...     fetching page 241 (48000 so far)...     fetching page 242 (48200 so far)...     fetching page 243 (48400 so far)...     fetching page 244 (48600 so far)...     fetching page 245 (48800 so far)...     fetching page 246 (49000 so far)...     fetching page 247 (49200 so far)...     fetching page 248 (49400 so far)...     fetching page 249 (49600 so far)...     fetching page 250 (49800 so far)...                                                               Found 50000 relations
   Trimmed to limit 50000: 50000 relations + 0 entities

3) Building deletion batches...
   Total delete ops: 50000 across 10 batches (batchSize=5000)

4) Proposing deletion batches to DAO (propose + vote + execute)...

   Batch 1/10: 5000 delete ops
     proposalId: 0x0807650804434e4b80c7500114c32d2c
     propose tx: 0x00311189b2d7c8235656bc7bb1baf73ecb027dab864e86ff606ab416c73478ea (status: success)
     vote tx: 0xe4e763d6311d8af185a33ecc47d428c567ff21a591389f130cab20b3c201357f (status: success)
     auto-executed with vote
     batch time: 14s | avg: 14s | ETA: 2m 6s (9 remaining)

   Batch 2/10: 5000 delete ops
     proposalId: 0x916039d38eb44a46a7169f067f4aa062
     propose tx: 0xd5f64fe163a39386f8ca91cd9ec7b82658186a7f7c020b5643495307f9fafd01 (status: success)
     vote tx: 0xa3e4a9a6dc5a8201eb1b6287ea9a88da403c2f95086f442db246703229ca9675 (status: success)
     auto-executed with vote
     batch time: 15s | avg: 14s | ETA: 1m 57s (8 remaining)

   Batch 3/10: 5000 delete ops
     proposalId: 0x38130bab201540f7924a7c49889c1c0f
     propose tx: 0x4ffb9afc86f6322c5a6f29199464f171d1114ca2e46a2e6712ebfe0d826129ac (status: success)
     vote tx: 0xcc54f62c15c00e7a60e4957e0b5aa4e9098696a89f72b2a9627df42b8a8ac586 (status: success)
     auto-executed with vote
     batch time: 14s | avg: 14s | ETA: 1m 41s (7 remaining)

   Batch 4/10: 5000 delete ops
     proposalId: 0xfd7b4255cbd54573ae903eb3aeb392b6
     propose tx: 0x8596a7c738c0b4e825f8e03081e19775abb5b332bb9f95e800935ea0519990ce (status: success)
     vote tx: 0x764cbcacd4cadec323696b95d13e6a82b61e645abb31c37a72c1f628aa040eaf (status: success)
     auto-executed with vote
     batch time: 14s | avg: 14s | ETA: 1m 26s (6 remaining)

   Batch 5/10: 5000 delete ops
     proposalId: 0xcc1eb91607d64af289f3b2fc2e602a36
     propose tx: 0xb6060e8b3b29261921b375d186fb5df912b3c3aca501896b105a4099bfeb9747 (status: success)
     vote tx: 0x71b0a1adc6e786755344c69b2c1ae3e27aae0d54e7c63d5a71f3740abac55fa5 (status: success)
     auto-executed with vote
     batch time: 14s | avg: 14s | ETA: 1m 12s (5 remaining)

   Batch 6/10: 5000 delete ops
     proposalId: 0x9975adbe3d4d451d90415d7cf934c204
     propose tx: 0x08f9574fee7c6407b0045d0fce7b2cbf2f257eb6b4ad8665ca8ea871e8347c00 (status: success)
     vote tx: 0x534bd5cd136cb478e0d3ac769e4e77d4b11de7f562109c8015108e99f8b57d19 (status: success)
     auto-executed with vote
     batch time: 14s | avg: 14s | ETA: 57s (4 remaining)

   Batch 7/10: 5000 delete ops
     proposalId: 0x29cffc6b922646bf80ae3c93df87ece4
     propose tx: 0x64ed9bee69925cce48c2b5be7f948e83fc88fe56bafb3e298c5bbb61d86587ca (status: success)
     vote tx: 0xe63d60b6e45836cdb297781bf975fe94e48b70580445359112c7e1ea715600c1 (status: success)
     auto-executed with vote
     batch time: 24s | avg: 15s | ETA: 47s (3 remaining)

   Batch 8/10: 5000 delete ops
     proposalId: 0x236d23510f0c4c2da064689489fd47bb
     propose tx: 0xb00f524b7f6813c02f76a38510b9c4526e7438b86515b50c9c7c219f3fe704cb (status: success)
     vote tx: 0xc1a543ae079e3e88e96debd36f677d7b83ed68c21b7fa57e4e2b6347fbb3a5d9 (status: success)
     auto-executed with vote
     batch time: 14s | avg: 15s | ETA: 31s (2 remaining)

   Batch 9/10: 5000 delete ops
     proposalId: 0xc7b6b4b004f940acb279f7ab67de6f03
     propose tx: 0xb09b78e134b04568db5f3a12c84203facb0f258e2db21f5e427a5a3f1b855589 (status: success)
     vote tx: 0x20cc65c1e1a3037fca74a76481852d45124ea3cfc9c5d6cd63907deff5cc3d41 (status: success)
     auto-executed with vote
     batch time: 14s | avg: 15s | ETA: 15s (1 remaining)

   Batch 10/10: 5000 delete ops
     proposalId: 0xf0f93077c662403e8216a7677f91bdce
     propose tx: 0xfbe3d50f325b825f515ba0e76fa61147d429cde3fff87de898695b44d43c551c (status: success)
     vote tx: 0x1f9cd1f602dff246632613627b4621391853b22fc75737d3bda97762db197a20 (status: success)
     auto-executed with vote
     batch time: 14s | avg: 15s | ETA: 0s (0 remaining)

5) Post-verification...
   Entities:  142110 → 142110 (Δ 0)
   Relations: 252945 → 252945 (Δ 0)
   Ops attempted: 50000 | Actually deleted: 0
   Items remain. Run the script again to continue.

=== Timing Summary ===
  Total elapsed: 3m 9s
  Batches: 10 completed, 0 failed, 10 total
  Avg batch time: 15s
  Throughput: 15792.1 items/min
  Progress logged to: /Users/riccardoesclapon/Documents/github/geo_mcp_server/backups/deletion-progress.jsonl

   Pass 1 done. 142110 entities + 252945 relations remain. Starting next pass...

============================================================
=== Pass 2 ===
============================================================

0) Querying before-counts...
   Entities before:  142110
   Relations before: 252945

1) Querying entities in DAO space...
     fetching page 1 (0 so far)...     fetching page 2 (200 so far)...     fetching page 3 (400 so far)...     fetching page 4 (600 so far)...     fetching page 5 (800 so far)...     fetching page 6 (1000 so far)...     fetching page 7 (1200 so far)...     fetching page 8 (1400 so far)...     fetching page 9 (1600 so far)...     fetching page 10 (1800 so far)...     fetching page 11 (2000 so far)...     fetching page 12 (2200 so far)...     fetching page 13 (2400 so far)...     fetching page 14 (2600 so far)...     fetching page 15 (2800 so far)...     fetching page 16 (3000 so far)...     fetching page 17 (3200 so far)...     fetching page 18 (3400 so far)...     fetching page 19 (3600 so far)...     fetching page 20 (3800 so far)...     fetching page 21 (4000 so far)...     fetching page 22 (4200 so far)...     fetching page 23 (4400 so far)...     fetching page 24 (4600 so far)...     fetching page 25 (4800 so far)...     fetching page 26 (5000 so far)...     fetching page 27 (5200 so far)...     fetching page 28 (5400 so far)...     fetching page 29 (5600 so far)...     fetching page 30 (5800 so far)...     fetching page 31 (6000 so far)...     fetching page 32 (6200 so far)...     fetching page 33 (6400 so far)...     fetching page 34 (6600 so far)...     fetching page 35 (6800 so far)...     fetching page 36 (7000 so far)...     fetching page 37 (7200 so far)...     fetching page 38 (7400 so far)...     fetching page 39 (7600 so far)...     fetching page 40 (7800 so far)...     fetching page 41 (8000 so far)...     fetching page 42 (8200 so far)...     fetching page 43 (8400 so far)...     fetching page 44 (8600 so far)...     fetching page 45 (8800 so far)...     fetching page 46 (9000 so far)...     fetching page 47 (9200 so far)...     fetching page 48 (9400 so far)...     fetching page 49 (9600 so far)...     fetching page 50 (9800 so far)...     fetching page 51 (10000 so far)...     fetching page 52 (10200 so far)...     fetching page 53 (10400 so far)...     fetching page 54 (10600 so far)...     fetching page 55 (10800 so far)...     fetching page 56 (11000 so far)...     fetching page 57 (11200 so far)...     fetching page 58 (11400 so far)...     fetching page 59 (11600 so far)...     fetching page 60 (11800 so far)...     fetching page 61 (12000 so far)...     fetching page 62 (12200 so far)...     fetching page 63 (12400 so far)...     fetching page 64 (12600 so far)...     fetching page 65 (12800 so far)...     fetching page 66 (13000 so far)...     fetching page 67 (13200 so far)...     fetching page 68 (13400 so far)...     fetching page 69 (13600 so far)...     fetching page 70 (13800 so far)...     fetching page 71 (14000 so far)...     fetching page 72 (14200 so far)...     fetching page 73 (14400 so far)...     fetching page 74 (14600 so far)...     fetching page 75 (14800 so far)...     fetching page 76 (15000 so far)...     fetching page 77 (15200 so far)...     fetching page 78 (15400 so far)...     fetching page 79 (15600 so far)...     fetching page 80 (15800 so far)...     fetching page 81 (16000 so far)...     fetching page 82 (16200 so far)...     fetching page 83 (16400 so far)...     fetching page 84 (16600 so far)...     fetching page 85 (16800 so far)...     fetching page 86 (17000 so far)...     fetching page 87 (17200 so far)...     fetching page 88 (17400 so far)...     fetching page 89 (17600 so far)...     fetching page 90 (17800 so far)...     fetching page 91 (18000 so far)...     fetching page 92 (18200 so far)...     fetching page 93 (18400 so far)...     fetching page 94 (18600 so far)...     fetching page 95 (18800 so far)...     fetching page 96 (19000 so far)...     fetching page 97 (19200 so far)...     fetching page 98 (19400 so far)...     fetching page 99 (19600 so far)...     fetching page 100 (19800 so far)...     fetching page 101 (20000 so far)...     fetching page 102 (20200 so far)...     fetching page 103 (20400 so far)...     fetching page 104 (20600 so far)...     fetching page 105 (20800 so far)...     fetching page 106 (21000 so far)...     fetching page 107 (21200 so far)...     fetching page 108 (21400 so far)...     fetching page 109 (21600 so far)...     fetching page 110 (21800 so far)...     fetching page 111 (22000 so far)...     fetching page 112 (22200 so far)...     fetching page 113 (22400 so far)...     fetching page 114 (22600 so far)...     fetching page 115 (22800 so far)...     fetching page 116 (23000 so far)...     fetching page 117 (23200 so far)...     fetching page 118 (23400 so far)...     fetching page 119 (23600 so far)...     fetching page 120 (23800 so far)...     fetching page 121 (24000 so far)...     fetching page 122 (24200 so far)...     fetching page 123 (24400 so far)...     fetching page 124 (24600 so far)...     fetching page 125 (24800 so far)...     fetching page 126 (25000 so far)...     fetching page 127 (25200 so far)...     fetching page 128 (25400 so far)...     fetching page 129 (25600 so far)...     fetching page 130 (25800 so far)...     fetching page 131 (26000 so far)...     fetching page 132 (26200 so far)...     fetching page 133 (26400 so far)...     fetching page 134 (26600 so far)...     fetching page 135 (26800 so far)...     fetching page 136 (27000 so far)...     fetching page 137 (27200 so far)...     fetching page 138 (27400 so far)...     fetching page 139 (27600 so far)...     fetching page 140 (27800 so far)...     fetching page 141 (28000 so far)...     fetching page 142 (28200 so far)...     fetching page 143 (28400 so far)...     fetching page 144 (28600 so far)...     fetching page 145 (28800 so far)...     fetching page 146 (29000 so far)...     fetching page 147 (29200 so far)...     fetching page 148 (29400 so far)...     fetching page 149 (29600 so far)...     fetching page 150 (29800 so far)...     fetching page 151 (30000 so far)...     fetching page 152 (30200 so far)...     fetching page 153 (30400 so far)...     fetching page 154 (30600 so far)...     fetching page 155 (30800 so far)...     fetching page 156 (31000 so far)...     fetching page 157 (31200 so far)...     fetching page 158 (31400 so far)...     fetching page 159 (31600 so far)...     fetching page 160 (31800 so far)...     fetching page 161 (32000 so far)...     fetching page 162 (32200 so far)...     fetching page 163 (32400 so far)...     fetching page 164 (32600 so far)...     fetching page 165 (32800 so far)...     fetching page 166 (33000 so far)...     fetching page 167 (33200 so far)...     fetching page 168 (33400 so far)...     fetching page 169 (33600 so far)...     fetching page 170 (33800 so far)...     fetching page 171 (34000 so far)...     fetching page 172 (34200 so far)...     fetching page 173 (34400 so far)...     fetching page 174 (34600 so far)...     fetching page 175 (34800 so far)...     fetching page 176 (35000 so far)...     fetching page 177 (35200 so far)...     fetching page 178 (35400 so far)...     fetching page 179 (35600 so far)...     fetching page 180 (35800 so far)...     fetching page 181 (36000 so far)...     fetching page 182 (36200 so far)...     fetching page 183 (36400 so far)...     fetching page 184 (36600 so far)...     fetching page 185 (36800 so far)...     fetching page 186 (37000 so far)...     fetching page 187 (37200 so far)...     fetching page 188 (37400 so far)...     fetching page 189 (37600 so far)...     fetching page 190 (37800 so far)...     fetching page 191 (38000 so far)...     fetching page 192 (38200 so far)...     fetching page 193 (38400 so far)...     fetching page 194 (38600 so far)...     fetching page 195 (38800 so far)...     fetching page 196 (39000 so far)...     fetching page 197 (39200 so far)...     fetching page 198 (39400 so far)...     fetching page 199 (39600 so far)...     fetching page 200 (39800 so far)...     fetching page 201 (40000 so far)...     fetching page 202 (40200 so far)...     fetching page 203 (40400 so far)...     fetching page 204 (40600 so far)...     fetching page 205 (40800 so far)...     fetching page 206 (41000 so far)...     fetching page 207 (41200 so far)...     fetching page 208 (41400 so far)...     fetching page 209 (41600 so far)...     fetching page 210 (41800 so far)...     fetching page 211 (42000 so far)...     fetching page 212 (42200 so far)...     fetching page 213 (42400 so far)...     fetching page 214 (42600 so far)...     fetching page 215 (42800 so far)...     fetching page 216 (43000 so far)...     fetching page 217 (43200 so far)...     fetching page 218 (43400 so far)...     fetching page 219 (43600 so far)...     fetching page 220 (43800 so far)...     fetching page 221 (44000 so far)...     fetching page 222 (44200 so far)...     fetching page 223 (44400 so far)...     fetching page 224 (44600 so far)...     fetching page 225 (44800 so far)...     fetching page 226 (45000 so far)...     fetching page 227 (45200 so far)...     fetching page 228 (45400 so far)...     fetching page 229 (45600 so far)...     fetching page 230 (45800 so far)...     fetching page 231 (46000 so far)...     fetching page 232 (46200 so far)...     fetching page 233 (46400 so far)...     fetching page 234 (46600 so far)...     fetching page 235 (46800 so far)...     fetching page 236 (47000 so far)...     fetching page 237 (47200 so far)...     fetching page 238 (47400 so far)...     fetching page 239 (47600 so far)...     fetching page 240 (47800 so far)...     fetching page 241 (48000 so far)...     fetching page 242 (48200 so far)...     fetching page 243 (48400 so far)...     fetching page 244 (48600 so far)...     fetching page 245 (48800 so far)...     fetching page 246 (49000 so far)...     fetching page 247 (49200 so far)...     fetching page 248 (49400 so far)...     fetching page 249 (49600 so far)...     fetching page 250 (49800 so far)...                                                               Found 50000 entities
   Sample:
     - 5650be6c8e9946698eb43d7bff95019a :: 0x8218f02D37bEC2bf4aa982a60A61B31353d972c7
     - 1c44c862740b439e94cbd9e66d644e36 :: 0x8218f02D37bEC2bf4aa982a60A61B31353d972c7
     - e291409ac8bc44809aa107e510f76b76 :: 0x8218f02D37bEC2bf4aa982a60A61B31353d972c7
     - 470cd4231c264ad886423ce56f61ecc8 :: 0x8218f02D37bEC2bf4aa982a60A61B31353d972c7
     - 4a0493fd9a644b2e87a64829a19c781e :: 0x8218f02D37bEC2bf4aa982a60A61B31353d972c7
   ... and 49995 more

2) Querying relations in DAO space...
     fetching page 1 (0 so far)...     fetching page 2 (200 so far)...     fetching page 3 (400 so far)...     fetching page 4 (600 so far)...     fetching page 5 (800 so far)...     fetching page 6 (1000 so far)...     fetching page 7 (1200 so far)...     fetching page 8 (1400 so far)...     fetching page 9 (1600 so far)...     fetching page 10 (1800 so far)...     fetching page 11 (2000 so far)...     fetching page 12 (2200 so far)...     fetching page 13 (2400 so far)...     fetching page 14 (2600 so far)...     fetching page 15 (2800 so far)...     fetching page 16 (3000 so far)...     fetching page 17 (3200 so far)...     fetching page 18 (3400 so far)...     fetching page 19 (3600 so far)...     fetching page 20 (3800 so far)...     fetching page 21 (4000 so far)...     fetching page 22 (4200 so far)...     fetching page 23 (4400 so far)...     fetching page 24 (4600 so far)...     fetching page 25 (4800 so far)...     fetching page 26 (5000 so far)...     fetching page 27 (5200 so far)...     fetching page 28 (5400 so far)...     fetching page 29 (5600 so far)...     fetching page 30 (5800 so far)...     fetching page 31 (6000 so far)...     fetching page 32 (6200 so far)...     fetching page 33 (6400 so far)...     fetching page 34 (6600 so far)...     fetching page 35 (6800 so far)...     fetching page 36 (7000 so far)...     fetching page 37 (7200 so far)...     fetching page 38 (7400 so far)...     fetching page 39 (7600 so far)...     fetching page 40 (7800 so far)...     fetching page 41 (8000 so far)...     fetching page 42 (8200 so far)...     fetching page 43 (8400 so far)...     fetching page 44 (8600 so far)...     fetching page 45 (8800 so far)...     fetching page 46 (9000 so far)...     fetching page 47 (9200 so far)...     fetching page 48 (9400 so far)...     fetching page 49 (9600 so far)...     fetching page 50 (9800 so far)...     fetching page 51 (10000 so far)...     fetching page 52 (10200 so far)...     fetching page 53 (10400 so far)...     fetching page 54 (10600 so far)...     fetching page 55 (10800 so far)...     fetching page 56 (11000 so far)...     fetching page 57 (11200 so far)...     fetching page 58 (11400 so far)...     fetching page 59 (11600 so far)...     fetching page 60 (11800 so far)...     fetching page 61 (12000 so far)...     fetching page 62 (12200 so far)...     fetching page 63 (12400 so far)...     fetching page 64 (12600 so far)...     fetching page 65 (12800 so far)...     fetching page 66 (13000 so far)...     fetching page 67 (13200 so far)...     fetching page 68 (13400 so far)...     fetching page 69 (13600 so far)...     fetching page 70 (13800 so far)...     fetching page 71 (14000 so far)...     fetching page 72 (14200 so far)...     fetching page 73 (14400 so far)...     fetching page 74 (14600 so far)...     fetching page 75 (14800 so far)...     fetching page 76 (15000 so far)...     fetching page 77 (15200 so far)...     fetching page 78 (15400 so far)...     fetching page 79 (15600 so far)...     fetching page 80 (15800 so far)...     fetching page 81 (16000 so far)...     fetching page 82 (16200 so far)...     fetching page 83 (16400 so far)...     fetching page 84 (16600 so far)...     fetching page 85 (16800 so far)...     fetching page 86 (17000 so far)...     fetching page 87 (17200 so far)...     fetching page 88 (17400 so far)...     fetching page 89 (17600 so far)...     fetching page 90 (17800 so far)...     fetching page 91 (18000 so far)...     fetching page 92 (18200 so far)...     fetching page 93 (18400 so far)...     fetching page 94 (18600 so far)...     fetching page 95 (18800 so far)...     fetching page 96 (19000 so far)...     fetching page 97 (19200 so far)...     fetching page 98 (19400 so far)...     fetching page 99 (19600 so far)...     fetching page 100 (19800 so far)...     fetching page 101 (20000 so far)...     fetching page 102 (20200 so far)...     fetching page 103 (20400 so far)...     fetching page 104 (20600 so far)...     fetching page 105 (20800 so far)...     fetching page 106 (21000 so far)...     fetching page 107 (21200 so far)...     fetching page 108 (21400 so far)...     fetching page 109 (21600 so far)...     fetching page 110 (21800 so far)...     fetching page 111 (22000 so far)...     fetching page 112 (22200 so far)...     fetching page 113 (22400 so far)...     fetching page 114 (22600 so far)...     fetching page 115 (22800 so far)...     fetching page 116 (23000 so far)...     fetching page 117 (23200 so far)...     fetching page 118 (23400 so far)...     fetching page 119 (23600 so far)...     fetching page 120 (23800 so far)...     fetching page 121 (24000 so far)...     fetching page 122 (24200 so far)...     fetching page 123 (24400 so far)...     fetching page 124 (24600 so far)...     fetching page 125 (24800 so far)...     fetching page 126 (25000 so far)...     fetching page 127 (25200 so far)...     fetching page 128 (25400 so far)...     fetching page 129 (25600 so far)...     fetching page 130 (25800 so far)...     fetching page 131 (26000 so far)...     fetching page 132 (26200 so far)...     fetching page 133 (26400 so far)...     fetching page 134 (26600 so far)...     fetching page 135 (26800 so far)...     fetching page 136 (27000 so far)...     fetching page 137 (27200 so far)...     fetching page 138 (27400 so far)...     fetching page 139 (27600 so far)...     fetching page 140 (27800 so far)...     fetching page 141 (28000 so far)...     fetching page 142 (28200 so far)...     fetching page 143 (28400 so far)...     fetching page 144 (28600 so far)...     fetching page 145 (28800 so far)...     fetching page 146 (29000 so far)...     fetching page 147 (29200 so far)...     fetching page 148 (29400 so far)...     fetching page 149 (29600 so far)...     fetching page 150 (29800 so far)...     fetching page 151 (30000 so far)...     fetching page 152 (30200 so far)...     fetching page 153 (30400 so far)...     fetching page 154 (30600 so far)...     fetching page 155 (30800 so far)...     fetching page 156 (31000 so far)...     fetching page 157 (31200 so far)...     fetching page 158 (31400 so far)...     fetching page 159 (31600 so far)...     fetching page 160 (31800 so far)...     fetching page 161 (32000 so far)...     fetching page 162 (32200 so far)...     fetching page 163 (32400 so far)...     fetching page 164 (32600 so far)...     fetching page 165 (32800 so far)...     fetching page 166 (33000 so far)...     fetching page 167 (33200 so far)...     fetching page 168 (33400 so far)...     fetching page 169 (33600 so far)...     fetching page 170 (33800 so far)...     fetching page 171 (34000 so far)...     fetching page 172 (34200 so far)...     fetching page 173 (34400 so far)...     fetching page 174 (34600 so far)...     fetching page 175 (34800 so far)...     fetching page 176 (35000 so far)...     fetching page 177 (35200 so far)...     fetching page 178 (35400 so far)...     fetching page 179 (35600 so far)...     fetching page 180 (35800 so far)...     fetching page 181 (36000 so far)...     fetching page 182 (36200 so far)...     fetching page 183 (36400 so far)...     fetching page 184 (36600 so far)...     fetching page 185 (36800 so far)...     fetching page 186 (37000 so far)...     fetching page 187 (37200 so far)...     fetching page 188 (37400 so far)...     fetching page 189 (37600 so far)...     fetching page 190 (37800 so far)...     fetching page 191 (38000 so far)...     fetching page 192 (38200 so far)...     fetching page 193 (38400 so far)...     fetching page 194 (38600 so far)...     fetching page 195 (38800 so far)...     fetching page 196 (39000 so far)...     fetching page 197 (39200 so far)...     fetching page 198 (39400 so far)...     fetching page 199 (39600 so far)...     fetching page 200 (39800 so far)...     fetching page 201 (40000 so far)...     fetching page 202 (40200 so far)...     fetching page 203 (40400 so far)...     fetching page 204 (40600 so far)...     fetching page 205 (40800 so far)...     fetching page 206 (41000 so far)...     fetching page 207 (41200 so far)...     fetching page 208 (41400 so far)...     fetching page 209 (41600 so far)...     fetching page 210 (41800 so far)...     fetching page 211 (42000 so far)...     fetching page 212 (42200 so far)...     fetching page 213 (42400 so far)...     fetching page 214 (42600 so far)...     fetching page 215 (42800 so far)...     fetching page 216 (43000 so far)...     fetching page 217 (43200 so far)...     fetching page 218 (43400 so far)...     fetching page 219 (43600 so far)...     fetching page 220 (43800 so far)...     fetching page 221 (44000 so far)...     fetching page 222 (44200 so far)...     fetching page 223 (44400 so far)...     fetching page 224 (44600 so far)...     fetching page 225 (44800 so far)...     fetching page 226 (45000 so far)...     fetching page 227 (45200 so far)...     fetching page 228 (45400 so far)...     fetching page 229 (45600 so far)...     fetching page 230 (45800 so far)...     fetching page 231 (46000 so far)...     fetching page 232 (46200 so far)...     fetching page 233 (46400 so far)...     fetching page 234 (46600 so far)...     fetching page 235 (46800 so far)...     fetching page 236 (47000 so far)...     fetching page 237 (47200 so far)...     fetching page 238 (47400 so far)...     fetching page 239 (47600 so far)...     fetching page 240 (47800 so far)...     fetching page 241 (48000 so far)...     fetching page 242 (48200 so far)...     fetching page 243 (48400 so far)...     fetching page 244 (48600 so far)...     fetching page 245 (48800 so far)...     fetching page 246 (49000 so far)...     fetching page 247 (49200 so far)...     fetching page 248 (49400 so far)...     fetching page 249 (49600 so far)...     fetching page 250 (49800 so far)...                                                               Found 50000 relations
   Trimmed to limit 50000: 50000 relations + 0 entities

3) Building deletion batches...
   Total delete ops: 50000 across 10 batches (batchSize=5000)

4) Proposing deletion batches to DAO (propose + vote + execute)...

   Batch 1/10: 5000 delete ops
     proposalId: 0x02055dc71a1344a18f2689608f835bae
     propose tx: 0x8610d5e6ad1b3d1bf200953fd503e95c390faa8206ee43d9f217ac33d6ff2d6f (status: success)
     vote tx: 0xb7b43169956e568d611df04dcbf9b96dfec25f7f7c5a1870e1cce03dffd86f0d (status: success)
     auto-executed with vote
     batch time: 13s | avg: 13s | ETA: 2m 4s (9 remaining)

   Batch 2/10: 5000 delete ops
     proposalId: 0x73359241eab44b2886ee8dcde089de0c
     propose tx: 0xb9cb38610b567f2da343a1cb17861b5cead1bc5e9477d6c405abda6ea10e2df9 (status: success)
     vote tx: 0x9831e1cd2a9f06211e59eb243d26619611bf0f8707d42aed8e75159eae593842 (status: success)
     auto-executed with vote
     batch time: 14s | avg: 14s | ETA: 1m 52s (8 remaining)

   Batch 3/10: 5000 delete ops
     proposalId: 0xd20ec72aacd746cf9e3416ef3bb2b2bd
     propose tx: 0xa6c07d0b642e3d7d3f7cdb5a192bd21251b63b9173611304ae74a1d06b57dbcd (status: success)
     vote tx: 0x732c6f0ca3c9fd9fa1ceef42364ab8d848fa75dd82ee91ecd85998f2f20a4034 (status: success)
     auto-executed with vote
     batch time: 14s | avg: 14s | ETA: 1m 38s (7 remaining)

   Batch 4/10: 5000 delete ops
     proposalId: 0xe7fa7f0189834d22a4c1074f434f2547
     propose tx: 0x725302360655537e08269e1335b4973cc2dcde016fa58167843ac15dc7e5187e (status: success)
     vote tx: 0x05cc45108fd3fe30e3668704b1e502fc503dd8f2ae3a7488c71a11f05b1b8608 (status: success)
     auto-executed with vote
     batch time: 14s | avg: 14s | ETA: 1m 24s (6 remaining)

   Batch 5/10: 5000 delete ops
     proposalId: 0xa44d6283e9d64f63976e865607692b1f
     propose tx: 0x54b928e220f470263462355fd443b26007ffb3febeaf4461838fc7b42c31fe8a (status: success)
     vote tx: 0x933e518b956d9d35f97eff804bbd7b42235e63e414dc57b1e5a33cdf665424c6 (status: success)
     auto-executed with vote
     batch time: 14s | avg: 14s | ETA: 1m 10s (5 remaining)

   Batch 6/10: 5000 delete ops
     proposalId: 0xcba6f54030ac452cb7a3bd6f29363de8
     propose tx: 0x18a60cc41f0ec45654d1f9c18d1499077dad57cc0f0209d9a240dc8c60688aac (status: success)
     vote tx: 0xfe6130d1f1808b1f8a3129f1acbc3cef4a5614a6ca848624d1cd963a29c5a055 (status: success)
     auto-executed with vote
     batch time: 14s | avg: 14s | ETA: 56s (4 remaining)

   Batch 7/10: 5000 delete ops
     proposalId: 0xaa050988e5614fd3ab40fb1fd16d75a2
     propose tx: 0x868252fec03877a9274a787cad66fa5b967e3545a1ff1a0ee5c6be1fdd34d541 (status: success)
     vote tx: 0xdc2b3d3b24abb35d285b9bd3804e0f1710e9d69fe0bc1e60a915bc33ddfe778b (status: success)
     auto-executed with vote
     batch time: 14s | avg: 14s | ETA: 42s (3 remaining)

   Batch 8/10: 5000 delete ops
     proposalId: 0xe3b12ec427f14a4ea32b90d4f533abc8
     propose tx: 0xf3998a3c717d4c4ee02f64a8d77c6f2999dc80386185d29b033b3557f600852b (status: success)
     vote tx: 0xfb32c8d07c54405a704a5064aebd29a6eddfdee354b1b27765d1a4423a2f6467 (status: success)
     auto-executed with vote
     batch time: 14s | avg: 14s | ETA: 28s (2 remaining)

   Batch 9/10: 5000 delete ops
     proposalId: 0xff11437f8903486399a813c401b3368b
     propose tx: 0x208327490d812ef079a08360656fc1378add127981dc4603787a74c9852c7019 (status: success)
     vote tx: 0xa003fd99d1b0f81393038632b4d03e766021b1c58abf6f9da16f5a198f55adce (status: success)
     auto-executed with vote
     batch time: 14s | avg: 14s | ETA: 14s (1 remaining)

   Batch 10/10: 5000 delete ops
     proposalId: 0x330dffbb5eb64f45839a66bb3457d49f
     propose tx: 0x885a3c75e95699ab5db9fe8e0b01a69a1202be5a1eb8d8db09831365d520cc87 (status: success)
     vote tx: 0xac9fa7104ff77f9693167b67cd61dda102a56ae82142dcbee19ef27c5e7a780e (status: success)
     auto-executed with vote
     batch time: 14s | avg: 14s | ETA: 0s (0 remaining)

5) Post-verification...
   Entities:  142110 → 142110 (Δ 0)
   Relations: 252945 → 252945 (Δ 0)
   Ops attempted: 50000 | Actually deleted: 0
   Items remain. Run the script again to continue.

=== Timing Summary ===
  Total elapsed: 2m 57s
  Batches: 10 completed, 0 failed, 10 total
  Avg batch time: 14s
  Throughput: 16916.9 items/min
  Progress logged to: /Users/riccardoesclapon/Documents/github/geo_mcp_server/backups/deletion-progress.jsonl

   Pass 2 done. 142110 entities + 252945 relations remain. Starting next pass...

============================================================
=== Pass 3 ===
============================================================

0) Querying before-counts...
   Entities before:  142110
   Relations before: 252945

1) Querying entities in DAO space...
     fetching page 1 (0 so far)...     fetching page 2 (200 so far)...     fetching page 3 (400 so far)...